{
  "id": "exc_87j3jhv4",
  "fascicule_id": "fsc_bgjg6y6r",
  "combinaison": [
    "brq_mp34v0be",
    "brq_fg6sx6xx"
  ],
  "raison": "analyse_non_etablie",
  "etat_relecture": "brouillon",
  "note_interne": "Ressemblance de chaînes : mot emprunté en bloc, analyse en briques non établie. À vérifier dans le TLFi."
}
